{
  "canonical_language": "fr",
  "english_role": "faithful_translation",
  "analysis_sha256": "2a569d2aa0c1a09befa2fbc9fcc2b5f5fe6899e8889798fb6b2bef90cb4a44c8",
  "translation_of_fr_sha256": "a0dd08cefe8212601226ddcd90fe48ce01f08e49c53c5e290bb4726f2799b812",
  "fr": {
    "title": "HealthGraphBench : apport conditionnel des relations et complexité des procédures en santé réglementaire",
    "abstract": "HealthGraphBench étudie quand les relations apportent une information prédictive supplémentaire à l'histoire individuelle et à la popularité, et quelle complexité suffit pour l'exploiter. Trois tâches réglementaires rétrospectives distinguent comparaisons de procédures, interventions sur une étape et confirmation temporelle non réalisée. RC3.1 termine 75 nouveaux fits sous plafonds, sans réentraîner les BPR conservés. Sur Part D 2024, un vote cosinus sélectionné sur validation atteint un rappel micro@10 de 0,258583 contre 0,236182 pour BPR : différence +0,022401, intervalle apparié conditionnel [0,014212;0,030800]. Le gain se concentre sur les candidats soutenus par les pairs ; les candidats rares ou faiblement soutenus présentent des revers. GraphSAGE sélectionné atteint 0,145970 sous cette procédure, sans invalider toutes architectures. Dans MAUDE, les vraies arêtes d'agrégation dépassent une réassignation à degrés conservés, mais doubler le fanout n'apporte pas de gain constant et le lissage BPR varie selon période. Dans CMS, l'ajout de propriétaires, même restreints par un proxy documentaire, ne restaure pas un gain cohérent à l'histoire locale sur les mêmes inspections. Les courbes de charge incluent les unités sans positif et ne mesurent pas l'utilité clinique. Les intervalles conditionnent sur les fits/configurations figés, sans couverture de sélection ou garantie simultanée. Les cibles avaient déjà été consultées : les résultats sont exploratoires, non une confirmation temporelle indépendante ou une reproduction humaine extérieure.",
    "sections": [
      {
        "id": "question",
        "heading": "Question : information relationnelle et complexité des procédures",
        "latex": "Les relations entre entités peuvent refléter un signal partagé, une popularité commune ou une dépendance déjà absorbée par l'histoire individuelle. Leur présence ne garantit donc pas un gain de prédiction. La question commune est : dans quelles situations les relations apportent-elles une information prédictive supplémentaire à l'historique individuel et à la popularité, et quelle complexité faut-il pour l'exploiter ?\n\nNous distinguons trois objets : la comparaison de procédures raisonnablement réglées ; les interventions qui isolent une étape ou un facteur de ces procédures ; et une confirmation sur une cible réellement non consultée. RC3.1 réalise les deux premiers sur des périodes déjà consultées. Le verrou préalable des nouveaux calculs n'efface pas cette exposition : toutes les analyses nouvelles restent exploratoires. La confirmation temporelle et l'étude d'une véritable équipe extérieure ne sont pas réalisées.\n\nL'opposition « graphe contre absence de graphe » serait trompeuse. Un vote de voisins exploite les liens explicitement ; BPR apprend également à partir des relations, sans nécessairement propager des messages à l'inférence. Retirer une propagation ou un lissage ne retire pas toutes les informations relationnelles. Les contrastes sont donc interprétés au niveau des procédures et des étapes effectivement modifiées, non comme une décomposition exhaustive et causale des sources d'information."
      },
      {
        "id": "related_work",
        "heading": "Travaux connexes et conditions de comparaison",
        "latex": "Open Graph Benchmark structure les tâches, partitions et métriques communes ; RelBench et RelBench v2 étendent la prédiction relationnelle sur plusieurs tables avec des contraintes temporelles\\cite{hu2020ogb,robinson2024relbench,gu2026relbench}. Leurs bénéfices dans leurs propres conditions constituent un contrepoint à toute généralisation négative depuis HealthGraphBench. Nous ne reproduisons pas leurs classements.\n\nLes références simples, le choix des candidats et la temporalité influencent les comparaisons de liens\\cite{huang2023tgb,poursafaei2022}. MAUDE et Part D excluent ici les liens déjà connus pour l'entité cible ; la mémorisation directe ne peut donc suffire, mais les observations de pairs et la popularité restent informatives. Errica et ses collègues motivent des protocoles contrôlés dans le domaine distinct de la classification de graphes\\cite{errica2020} : cette référence n'est pas une preuve des mécanismes médicaux étudiés ici. Les travaux sur les fuites d'information et REFORMS motivent l'explicitation des cibles, données et limites\\cite{kapoor2023leakage,kapoor2024reforms}, sans certification de conformité. La revue narrative reprise de RC3 a été arrêtée au 29 septembre 2026 ; elle n'est pas une revue systématique actualisée par cette campagne."
      },
      {
        "id": "data",
        "heading": "Trois tâches, populations et disponibilité des données",
        "latex": "\\paragraph{MAUDE.} La cible est un lien code produit--code problème observé pour la première fois dans la fenêtre conservée, et non un diagnostic individuel. L'horloge est \\texttt{DATE\\_RECEIVED}, sans date de disponibilité publique vérifiée pour chaque champ. Un produit doit avoir au moins un signalement antérieur, le problème doit exister globalement dans le passé et le lien doit être absent de l'histoire du produit. Tous les problèmes admissibles sont classés, sans négatifs d'évaluation échantillonnés. L'histoire initiale est 2019T1--2022T4 ; 2023 est la validation et 2024--2025 les tests exploratoires. Les états sont réajustés annuellement ; l'histoire et les candidats évoluent après chaque trimestre évalué. Le vocabulaire inédit hors histoire n'est pas la cible de cette tâche\\cite{hgbcontract,hgbcode}.\n\n\\paragraph{CMS nursing homes.} La cible est une déficience standard G--L lors d'un épisode Health Standard retenu, défini par (CCN, date), avec au moins une inspection antérieure. La prédiction est construite rétrospectivement juste avant cet épisode : elle est \\emph{conditionnelle à une inspection ayant lieu}. Elle ne prédit ni la date ni la survenue d'inspection et n'est pas une priorisation nationale des établissements. La nouvelle préparation conserve les mêmes 23\\,712 lignes de 2019--2025 que Q2, les mêmes établissements, histoires locales et labels ; seuls les agrégats de propriétaires sont recomputés. Les ajustements pré-2023, pré-2024 et pré-2025 utilisent uniquement les lignes antérieures à l'année cible. Une date d'association antérieure ne garantit pas que le lien était alors public ou juridiquement actif ; les extraits actuels, fins de propriété inconnues et cycles retenus limitent la reconstruction\\cite{hgbcontract,hgbcode}.\n\n\\paragraph{Medicare Part D.} La préparation Q2 conservée est déclarée comme entrée dérivée vérifiée, non comme une nouvelle acquisition brute. Le médicament est le nom générique exact après retrait des espaces périphériques, non un concept RxNorm. Chaque cohorte annuelle contient 2\\,000 prescripteurs déjà observés, sélectionnés par l'ordre (SHA-256 du NPI, NPI). L'histoire 2019--2022 précède la validation 2023 et 2019--2023 le test 2024. Tous les médicaments déjà observés globalement dans l'histoire de la cohorte, sauf ceux déjà liés au prescripteur, sont candidats. Les 2\\,000 prescripteurs sont conservés même sans nouveau positif. Le positif est un lien \\emph{publié et observable}, pas une première prescription. La suppression CMS des combinaisons ayant au plus dix demandes empêche de traiter une absence publiée comme négatif clinique\\cite{cmspartd,hgbpartd}.\n\nLe calendrier d'événements ou de services n'est pas un calendrier d'accès public aux versions des fichiers. Tous les trois domaines sont rétrospectifs. Aucune représentativité nationale, couverture clinique exhaustive ou indépendance statistique d'une cohorte NPI disjointe n'est établie."
      },
      {
        "id": "methods",
        "heading": "Comparaison commune, interventions et analyses conditionnelles",